Поступление товаров,,,,,,,,,,,
"Пиво Большая Кружка Янтарное  4% 2,5л., Ц0000001289",3.000,18%,45.67,99.80,299.40,,,,,,
"Пиво Арсенальное крепкое 2.5л 7% алк, Ц0000001016",3.000,18%,51.38,112.28,336.84,,,,,,
"Пиво Карлсберг светлое 0.5 л 4.6% алк, Ц0000000888",10.000,18%,75.10,49.23,492.30,,,,,,
"Пиво Арсенальное Традиционное свет.4.7% 1,5л., Ц0000001296",3.000,18%,32.06,70.06,210.18,,,,,,
"Пиво Олд Бобби Эль 4,5% 0,568л., Ц0000001129",10.000,18%,65.59,43.00,430.00,,,,,,
"Пиво Хольстен Премиум светл. ж/б.  4.8% 1л., АВ000000357",3.000,18%,35.04,76.56,229.68,,,,,,
"Пиво Львовское свет. 4,5% 1л., АВ000000212",6.000,18%,42.17,46.07,276.42,,,,,,
"Пиво Арсенальное Традиционное свет.4.7% 2,5л., Ц0000001406",3.000,18%,49.06,107.21,321.63,,,,,,
"Пиво Ярпиво Янтарное 4.7% 1.5л, Ц0000001293",3.000,18%,32.70,71.46,214.38,,,,,,
"Пиво Балтика №7 свет.5,4% 0.5л., Ц0000000800",10.000,18%,56.06,36.75,367.50,,,,,,
"Пивной напиток Кроненбург 1664 Бланк 4,5% 0,46л., Ц0000001999",10.000,18%,80.42,52.72,527.20,,,,,,
"Пиво Туборг 4,6% 0,33л., Ц0000001128",12.000,18%,64.18,35.06,420.72,,,,,,
Поступление товаров АВ000000006 от 13.01.2014 13:56:37,,,,,,13.01.2014 13:56:37,АВ000000006,"ООО ""Монблан Премиум""",Да,"6,485.48",Да
"Пиво Богемия Регент Премиум свет.0,5 5%, РТ000000240",10.000,18%,129.51,84.90,849.00,,,,,,
"Пиво Брэйнс Са Смут свет.0,44 4%, РТ000000242",12.000,18%,175.05,95.63,"1,147.56",,,,,,
"Пиво Кайзердом Пилснер свет.ж/б 1,0 4,7%, РТ000000236",6.000,18%,196.65,214.86,"1,289.16",,,,,,
"Пиво Хофброй Мюнхнер Вайс свет.нефильт.0,5 5,1%, РТ000000238",10.000,18%,195.16,127.94,"1,279.40",,,,,,
"Пиво Циндао свет.0,64 4,7%, РТ000000245",12.000,18%,159.00,86.86,"1,042.32",,,,,,
"Сидр Кингстон Пресс 0,66 5,3%, РТ000000252",6.000,18%,133.94,146.34,878.04,,,,,,
Поступление товаров АВ000000007 от 13.01.2014 15:31:23,,,,,,13.01.2014 15:31:23,АВ000000007,"ООО ""Сигарный Дом Фортуна""",Да,"4,715.77",Да
"Сигариллы Cafe Creme, РТ000000319",2.000,18%,36.55,119.81,239.61,,,,,,
"Сигариллы Al Capone Bourbon vanilla, ЕС000000619",5.000,18%,43.25,56.70,283.50,,,,,,
"Сигариллы Slims, ЕС000000607",2.000,18%,26.79,87.81,175.61,,,,,,
"Сигариллы Cafe Creme Filter Vanilla Honeyswirl, ЕС000000605",2.000,18%,42.44,139.10,278.20,,,,,,
"Сигариллы Handelsgold Vanilla Cigarillos, РТ000000317",10.000,18%,70.33,46.10,461.03,,,,,,
"Сигариллы Handelsgold Cherry Cigarillos, РТ000000318",10.000,18%,70.33,46.10,461.03,,,,,,
"Сигариллы Half Corona, ЕС000000608",3.000,18%,76.88,168.00,503.99,,,,,,
"Зажигалка Zenga Mega  jet Russia, МЕ000000401",24.000,18%,159.97,43.70,"1,048.69",,,,,,
"Сигариллы Al Capone Sweet Cognac, ЕС000000620",5.000,18%,43.25,56.70,283.50,,,,,,
"Сигариллы Cafe Creme Filter Tip Arome, ЕС000000602",2.000,18%,42.44,139.10,278.20,,,,,,
"Сигариллы Handelsgold Classic Tip, ЕС000000615",5.000,18%,51.26,67.20,336.01,,,,,,
"Сигариллы Handelsgold Chocolate WoodTip, ЕС000000617",2.000,18%,25.14,82.40,164.80,,,,,,
"Сигариллы Handelsgold VanillaTip, ЕС000000616",3.000,18%,30.75,67.20,201.60,,,,,,
Поступление товаров АВ000000008 от 14.01.2014 14:14:06,,,,,,14.01.2014 14:14:06,АВ000000008,"ООО ""ЕВРО-АРТ""",Да,"29,565.30",Да
"Вино Шато Пей Де Фар  кр.сух.12.5% 0.75л., Ц0000000101",4.000,18%,130.07,213.17,852.68,,,,,,
"Вино Кьянти Ризерва DOCG С.К. кр. сух.12.5% 0.75л , РТ000000123",3.000,18%,138.34,302.30,906.90,,,,,,
"Вино Тур Де Пьер Медок кр.сух 13% 0.75л. , Ц0000000121",4.000,18%,163.61,268.14,"1,072.56",,,,,,
"Вино Шато Лубежак Бордо кр.сух.13.5% 0.75л., Ц0000000091",4.000,18%,134.09,219.76,879.04,,,,,,
"Вино игристое Спуманте Брют Виа Мирелла бел.10.5% 0.75л., Ц0000000079",12.000,18%,369.85,202.05,"2,424.60",,,,,,
"Вино игристое Ламбруско Виа Мирелла кр.сл. 7,5% 0,75л, Ц0000000368",6.000,18%,162.65,177.71,"1,066.26",,,,,,
"Водка Двойная Белая 40% 0.5л., Ц0000000928",6.000,18%,151.02,165.00,990.00,,,,,,
"Шампанское Абрау-Дюрсо бел.п/сух. 10,5-13% 0,75л., МЕ000000182",6.000,18%,210.39,229.87,"1,379.22",,,,,,
"Вино Хванчкара Ахалшени кр.п/сл.11,3% 0,75л., АВ000000384",6.000,18%,419.83,458.70,"2,752.20",,,,,,
"Коньяк Старый Кенигсберг 4 зв. 40% 0.1л., ЕС000000003",12.000,18%,152.01,83.04,996.48,,,,,,
"Вино Антонио Барбадилло кр.п/сл.14% 0.75л., РТ000000002",6.000,18%,158.06,172.70,"1,036.20",,,,,,
"Вино Мукузани кр.сух. Батоно бут. с лозой 10,5-12,5% 0,75л., МЕ000000153",4.000,18%,181.04,296.70,"1,186.80",,,,,,
"Виски Клан МакГрегор 40% 0.5л., Ц0000000028",6.000,18%,330.22,360.80,"2,164.80",,,,,,
"Водка Беленькая Золотая 40% 0.5л., Ц0000001272",6.000,18%,169.64,185.35,"1,112.10",,,,,,
"Вино игристое Спуманте Брют АП бел.11,5% 0,75 л., МЕ000000031",12.000,18%,436.12,238.25,"2,859.00",,,,,,
"Водка Корела 40% 0,5л., Ц0000001258",6.000,18%,191.29,209.00,"1,254.00",,,,,,
"Водка Двойная Белая 40% 0.7л., Ц0000000925",4.000,18%,137.01,224.54,898.16,,,,,,
"Водка Двойная Золотая 40% 0.5л., Ц0000000923",6.000,18%,151.02,165.00,990.00,,,,,,
"Водка Чистый Кристалл 40% 0.5л., Ц0000000940",10.000,18%,385.93,253.00,"2,530.00",,,,,,
"Коньяк Российский Бержерак 4-х лет 0,25  40%, Ц0000001942",10.000,18%,337.77,221.43,"2,214.30",,,,,,
Поступление товаров АВ000000009 от 15.01.2014 11:34:01,,,,,,15.01.2014 11:34:01,АВ000000009,"ЗАО ""НЕСКО Санкт -Петербург""",Да,"7,675.22",Да
"Вино АСПЕТИ НУР гранатовое кр п/сл 12% 0,75 л, Ц0000001863",6.000,18%,252.76,276.16,"1,656.96",,,,,,
"Водка Грей Гуз  40% 0,5л., МЕ000000384",2.000,18%,301.05,986.78,"1,973.56",,,,,,
"Настойка горькая Бульбашъ на бяр.пупышках 40% 0.2л., АВ000000296",20.000,18%,326.44,107.00,"2,140.00",,,,,,
"Виски Вильям Лоусонс 40% 0.2л., Ц0000000169",10.000,18%,290.55,190.47,"1,904.70",,,,,,
Поступление товаров АВ000000010 от 15.01.2014 17:21:51,,,,,,15.01.2014 17:21:51,АВ000000010,"ОАО ""Л Дистрибьюшен""",Да,"73,918.92",Да
"Ликёр Фруко Шульц ассорти В-52, АВ000000108",3.000,18%,140.52,307.07,921.21,,,,,,
"Текила Ранчо Алегре Бланко 40% 0,7л., АВ000000351",2.000,18%,189.84,622.25,"1,244.50",,,,,,
"Текила Ранчо Алегре Голд 40% 0,7л., АВ000000349",2.000,18%,189.84,622.25,"1,244.50",,,,,,
"Ликер Фруко Шульц Сливочный 17% 0,7л., Ц0000001357",3.000,18%,281.05,614.14,"1,842.42",,,,,,
"Ликер Фруко Шульц Пина Калада 15% 0,7л., Ц0000001356",3.000,18%,243.46,532.00,"1,596.00",,,,,,
"Ром Ямайский Капитан Морган  0,5л, ЕС000000648",3.000,18%,283.96,620.51,"1,861.53",,,,,,
"Текила Ольмека Белая Класико 38% 0,5л., Ц0000001359",3.000,18%,370.14,808.83,"2,426.49",,,,,,
"Водка Царская Золотая 40% 0,5л., Ц0000000991",12.000,18%,615.71,336.36,"4,036.32",,,,,,
"Настойка слад.Престиж Брусника на коньяке 18% 0,5л., РТ000000086",10.000,18%,261.56,171.47,"1,714.70",,,,,,
"Настойка слад.Престиж Клюква на коньяке 20% 0,5л., РТ000000088",5.000,18%,130.78,171.47,857.35,,,,,,
"Ликер эмульс.История Любви клубн./сливки 18% 0,5л., Ц0000000438",5.000,18%,155.44,203.80,"1,019.00",,,,,,
"Ликер История Любви мята 18% 0,5л., АВ000000197",5.000,18%,155.44,203.80,"1,019.00",,,,,,
"Виски Баллантайнс Файнест 40% 0,5л., Ц0000001801",5.000,18%,542.15,710.82,"3,554.10",,,,,,
"Водка Царская ориг.40% 0,7л., Ц0000000660",9.000,18%,638.95,465.41,"4,188.69",,,,,,
"Водка Царская Золотая 40% 0,7л., Ц0000000659",9.000,18%,843.40,614.33,"5,528.97",,,,,,
"Водка Царская ориг.40% 0.5л., Ц0000000993",12.000,18%,608.00,332.15,"3,985.80",,,,,,
"Ром Капитан Морган Золотой 35% 0.5л., Ц0000000508",5.000,18%,433.53,568.41,"2,842.05",,,,,,
"Виски Бэллс Ориджинал 40% 0,7л., Ц0000001807",3.000,18%,240.97,526.57,"1,579.71",,,,,,
"Ром Капитан Морган Пряный Золотой 0,7 л 35%, Ц0000001874",3.000,18%,350.16,765.17,"2,295.51",,,,,,
"Ликер Сливочный Бэйлис 17% 0,7л., Ц0000000451",3.000,18%,364.34,796.16,"2,388.48",,,,,,
"Виски Баллантайнс Файнест 40% 0,05л., РТ000000154",10.000,18%,117.79,77.22,772.20,,,,,,
"Виски Джемесон 40% 0.5л., Ц0000000010",3.000,18%,385.55,842.49,"2,527.47",,,,,,
"Джин Бифитер Лондон Драй 47% 0,5л., Ц0000000649",1.000,18%,113.11,741.51,741.51,,,,,,
"Коньяк Арарат  3 зв. 40% 0,5л. , Ц0000001792",2.000,18%,143.77,471.24,942.48,,,,,,
"Текила Ольмека Белая Класико 38% 0,7л., Ц0000001360",2.000,18%,331.33,"1,086.03","2,172.06",,,,,,
"Виски Баллантайнс Файнест 40% 0,7л., Ц0000001802",3.000,18%,417.26,911.79,"2,735.37",,,,,,
"Виски Джемесон 40% 0,7л., Ц0000000006",3.000,18%,524.63,"1,146.42","3,439.26",,,,,,
"Водка Абсолют 40% 0,7л., Ц0000001868",3.000,18%,292.67,639.54,"1,918.62",,,,,,
"Джин Бифитер Лондон Драй 47% 0,7л., РТ000000316",1.000,18%,163.10,"1,069.20","1,069.20",,,,,,
"Ликер Фруко Шульц амаретто 25% 0,7л., Ц0000000163",3.000,18%,243.46,532.00,"1,596.00",,,,,,
"Виски Уайт Хорс 40% 0,5л., Ц0000000005",3.000,18%,206.36,450.93,"1,352.79",,,,,,
"Коньяк Арарат  5 зв. п/у 40% 0,5л.  , Ц0000001794",2.000,18%,184.54,604.89,"1,209.78",,,,,,
"Водка Абсолют 40% 1л., Ц0000001869",5.000,18%,627.48,822.69,"4,113.45",,,,,,
"Вино Пиджиато бел.сух.т/п 10,5% 1л., Ц0000001910",10.000,18%,288.37,189.04,"1,890.40",,,,,,
"Вино Ладорье Бордо кр.сух.12.5% 0.75л., Ц0000000398",3.000,18%,118.25,258.40,775.20,,,,,,
"Вино Ладорье Бордо бел.сух.12% 0.75л., АВ000000381",2.000,18%,78.83,258.40,516.80,,,,,,
Поступление товаров АВ000000011 от 16.01.2014 14:29:02,,,,,,16.01.2014 14:29:02,АВ000000011,"ООО ""Невский синдикат""",Да,"7,316.88",Да
"Напиток сл/алк.Синебрюхофф Джин и Грейпфрут ж/б  6% 0,33л., ЕС000000469",24.000,18%,143.22,39.12,938.88,,,,,,
"Напиток сл/алк.Синебрюхофф Джин и Грейпфрут ж/б 8,8% 0,33л., МЕ000000418",24.000,18%,168.15,45.93,"1,102.32",,,,,,
"Напиток сл/алк.Синебрюхофф Джин и Грейпфрут ж/б 8,8% 0,5л., ЕС000000373",24.000,18%,228.63,62.45,"1,498.80",,,,,,
"Напиток сл/алк.Синебрюхофф Джин и Лайм ж/б 8,8% 0,5л., АВ000000393",24.000,18%,228.63,62.45,"1,498.80",,,,,,
"Напиток сл/алк.Гриноллс ж/б 7% 0,33л., Ц0000001097",24.000,18%,146.95,40.14,963.36,,,,,,
"Напиток сл/алк.Гриноллс Ориджинал ж/б 7,2% 0,5л., МЕ000000419",24.000,18%,200.55,54.78,"1,314.72",,,,,,
Поступление товаров АВ000000012 от 16.01.2014 17:12:15,,,,,,16.01.2014 17:12:15,АВ000000012,"ООО ""ТК Балтика""",Да,"27,134.44",Да
"Бальзам Бугульма 40% 0,25л., АВ000000286",10.000,18%,147.95,96.99,969.90,,,,,,
"Бальзам Бугульма 40% 0,5л., АВ000000287",15.000,18%,413.79,180.84,"2,712.60",,,,,,
"Водка Золотая Грань 40% 0,5л., АВ000000282",10.000,18%,236.44,155.00,"1,550.00",,,,,,
"Водка Серебряная Грань 40% 0,5л., АВ000000281",10.000,18%,236.44,155.00,"1,550.00",,,,,,
"Водка Стерва п/у 40% 0,7л., АВ000000284",2.000,18%,199.36,653.47,"1,306.94",,,,,,
"Коньяк Золотая выдержка 4 зв. 40% 0,25л., ЕС000000582",10.000,18%,323.24,211.90,"2,119.00",,,,,,
"Коньяк Золотая Выдержка 4 зв. п/у 40% 0,5л., АВ000000275",1.000,18%,63.85,418.60,418.60,,,,,,
"Коньяк Золотая Выдержка 4 зв. 40% 0,5л., Ц0000001953",6.000,18%,356.95,390.00,"2,340.00",,,,,,
"Коньяк Золотая Выдержка  5 зв.40% 0,25л., Ц0000001957",6.000,18%,220.12,240.50,"1,443.00",,,,,,
"Коньяк Золотая Выдержка 5 зв. 40% 0,5л., Ц0000001958",6.000,18%,396.21,432.90,"2,597.40",,,,,,
"Коньяк Золотая Выдержка 5 зв. фл. 40% 0,5л., Ц0000001959",6.000,18%,385.51,421.20,"2,527.20",,,,,,
"Коньяк Старейшина 5-ти лет.40% 0,5л., АВ000000394",4.000,18%,305.39,500.50,"2,002.00",,,,,,
"Коньяк Старейшина КВ 7 лет 40% 0,5л., АВ000000273",4.000,18%,391.85,642.20,"2,568.80",,,,,,
"Коньяк Старейшина 5-ти лет.40% 0,25л., Ц0000001949",10.000,18%,462.05,302.90,"3,029.00",,,,,,
Поступление товаров АВ000000013 от 17.01.2014 12:09:32,,,,,,17.01.2014 12:09:32,АВ000000013,"ООО ""СЗК ""Аврора""",Да,"2,845.34",Да
"Конфеты Раффаэлло 150гр., Ц0000000025",6.000,18%,136.55,149.19,895.14,,,,,,
"Шоколад горький десерт.Коммунарка с апел.соком 200гр., АВ000000094",5.000,18%,57.93,75.95,379.75,,,,,,
"Шоколадные конфеты Милленниум Ривьера 250гр., АВ000000236",3.000,18%,77.21,168.71,506.13,,,,,,
"Конфеты Тоффифии 125гр., Ц0000000845",3.000,18%,35.04,76.56,229.68,,,,,,
"Конфеты Мерси ассорти красный 250гр., Ц0000000031",2.000,18%,54.57,178.87,357.74,,,,,,
"Шоколад  Millennium молочный с цельным орехом 100гр., ЕС000000135",10.000,18%,72.75,47.69,476.90,,,,,,
Поступление товаров АВ000000014 от 17.01.2014 17:04:59,,,,,,17.01.2014 17:04:59,АВ000000014,"ООО ""Невский синдикат""",Да,"4,469.41",Да
"Пиво Ярпиво Янтарное 4.7% 0.5л, Ц0000001300",12.000,18%,51.25,28.00,336.00,,,,,,
"Пиво Большая Кружка Янтарное  4% 2,5л., Ц0000001289",3.000,18%,45.67,99.80,299.40,,,,,,
"Пиво Арсенальное крепкое 7% 1,5л., Ц0000001291",3.000,18%,35.64,77.87,233.61,,,,,,
"Пиво Варштайнер Премиум Верум свет.4,8% 0,5 л., АВ000000368",10.000,18%,78.10,51.20,512.00,,,,,,
"Пиво Арсенальное Традиционное свет.4.7% 1,5л., Ц0000001296",3.000,18%,32.06,70.06,210.18,,,,,,
"Пиво Хольстен Премиум свет. ж/б.  4.8% 0,5л., Ц0000000810",12.000,18%,81.46,44.50,534.00,,,,,,
"Пиво Балтика Прага свет.0,5 4,6%, РТ000000263",10.000,18%,51.79,33.95,339.50,,,,,,
"Пиво Арсенальное крепкое 0.5л 7% алк, Ц0000001012",10.000,18%,47.41,31.08,310.80,,,,,,
"Пиво Жатецкий Гусь  свет.ж/б 4.6% 0,5л., Ц0000001403",12.000,18%,65.35,35.70,428.40,,,,,,
"Пиво Туборг 4,6% 0,33л., Ц0000001128",12.000,18%,64.18,35.06,420.72,,,,,,
"Пиво Кофф свет. ж/б 4,5% 0,5л., Ц0000002004",24.000,18%,128.87,35.20,844.80,,,,,,
Поступление товаров АВ000000015 от 21.01.2014 12:36:24,,,,,,21.01.2014 12:36:24,АВ000000015,"ООО ""ЕВРО-АРТ""",Да,"67,477.59",Да
"Вино Шато Пей Де Фар  кр.сух.12.5% 0.75л., Ц0000000101",6.000,18%,195.10,213.17,"1,279.02",,,,,,
"Вино Примо Альберо Кьянти DOCG кр.сух.12,5% 0,75л., РТ000000112",6.000,18%,177.88,194.35,"1,166.10",,,,,,
"Вино Форе Дэ Конт  бел.сух. 11,5%  0.75л , Ц0000001221",6.000,18%,135.79,148.36,890.16,,,,,,
"Вино Бордо Шато О Бурсье кр.сух. 14% 0.75 л., Ц0000002093",6.000,18%,219.73,240.08,"1,440.48",,,,,,
"Вино Тоскано IGT Иль Фонтино кр.сух.0.75 12%, РТ000000125",6.000,18%,158.76,173.46,"1,040.76",,,,,,
"Вино Форе Дэ Конт кр.сух. 12% 0,75л., Ц0000001197",6.000,18%,132.21,144.45,866.70,,,,,,
"Коньяк Старый Кенигсберг 4-лет.40% 0,375л., РТ000000015",10.000,18%,434.04,284.54,"2,845.40",,,,,,
"Коньяк Старый  Кенигсберг фляга  4-лет.40% 0,5л. , РТ000000016",10.000,18%,553.94,363.14,"3,631.40",,,,,,
"Водка Белуга 40% 0.7л., Ц0000000986",3.000,18%,376.03,821.70,"2,465.10",,,,,,
"Водка Белуга 40% 1л., Ц0000001423",4.000,18%,668.50,"1,095.60","4,382.40",,,,,,
"Водка Цельсий лайт  40%  0,7л., ЕС000000059",6.000,18%,235.06,256.82,"1,540.92",,,,,,
"Вино Ле Жарден Дю Руа кр.п/сл. 10,5% 0,75л., ЕС000000061",5.000,18%,129.79,170.17,850.85,,,,,,
"Вино Антонио Барбадилло бел.сух.12,5% 0.75л., Ц0000001914",4.000,18%,105.38,172.70,690.80,,,,,,
"Пиво Кальтенберг Хель свет. ж/б 4.5% 0.5л., ЕС000000472",6.000,18%,44.74,48.88,293.28,,,,,,
"Водка Казацкая Рада Особая 40% 0,25л., АВ000000395",10.000,18%,144.00,94.40,944.00,,,,,,
"Водка Казацкая Рада Особая 40% 0,5л., АВ000000396",5.000,18%,135.40,177.52,887.60,,,,,,
"Водка Казацкая Рада 40% 0,25л., МЕ000000129",10.000,18%,144.00,94.40,944.00,,,,,,
"Виски Клан МакГрегор п/у 40% 0,7л., РТ000000018",6.000,18%,470.17,513.70,"3,082.20",,,,,,
"Виски Грантс 40% 0,75л., Ц0000001187",6.000,18%,781.76,854.15,"5,124.90",,,,,,
"Водка Белуга 40% 0.5л., Ц0000000985",4.000,18%,355.73,583.00,"2,332.00",,,,,,
"Водка Царская Марка  люкс 40% 0,7л., МЕ000000135",6.000,18%,195.21,213.29,"1,279.74",,,,,,
"Вино Шато Фон Боннет кр.сух.13% 0.75л., МЕ000000052",6.000,18%,269.84,294.82,"1,768.92",,,,,,
"Вино Примо Альберо Соаве DOC бел.сух.12% 0,75л., РТ000000117",6.000,18%,171.85,187.76,"1,126.56",,,,,,
"Вино Примо Альберо Шардоне бел.сух.11,5% 0,75л., РТ000000111",6.000,18%,168.75,184.38,"1,106.28",,,,,,
"Вино Шевалье Дю Лак кр.п/сл. 12% 0,75л., МЕ000000023",6.000,18%,135.79,148.36,890.16,,,,,,
"Вино Шевалье Дю Лак бел. п/слад.11% 0,75л., АВ000000291",6.000,18%,140.00,152.96,917.76,,,,,,
"Вино Принчипеско Вальполичелла кр.сух. 12% 0.75л, Ц0000000432",4.000,18%,169.00,276.98,"1,107.92",,,,,,
"Вино Эспада Негра бел. п/сух. 11% 0,75л., Ц0000001198",6.000,18%,108.36,118.39,710.34,,,,,,
"Вино Миранзана Грилло Сицилия бел.сух.12% 0.75л., АВ000000397",4.000,18%,115.15,188.72,754.88,,,,,,
"Коньяк Московский 4* 40 0.1л, Ц0000001285",10.000,18%,137.59,90.20,902.00,,,,,,
"Настойка Зубровка 40% 0.5л., Ц0000000314",10.000,18%,293.64,192.50,"1,925.00",,,,,,
"Коньяк  Московский 3* 40% 0.1л., Ц0000001281",15.000,18%,165.07,72.14,"1,082.10",,,,,,
"Коньяк Московский 3* 40% 0.25л, Ц0000000293",10.000,18%,238.19,156.15,"1,561.50",,,,,,
"Коньяк Московский 3* 40% 0.5л, Ц0000000296",6.000,18%,266.80,291.50,"1,749.00",,,,,,
"Водка Путинка графин 40% 0.75л., Ц0000000992",6.000,18%,523.53,572.00,"3,432.00",,,,,,
"Водка Корела 40% 1л., Ц0000000938",6.000,18%,293.30,320.46,"1,922.76",,,,,,
"Водка Столичная 40% 0,5л., Ц0000000939",20.000,18%,731.59,239.80,"4,796.00",,,,,,
"Водка Царская Марка  мягкая  40% 0,7л., МЕ000000136",6.000,18%,195.21,213.29,"1,279.74",,,,,,
"Водка Царская Марка кедровая 40% 0,7л., АВ000000271",4.000,18%,130.14,213.29,853.16,,,,,,
"Вино Романдиола Санджовезе ди Романья Супериоре Ризерва кр.сух.13% 0.75л., Ц0000000113",6.000,18%,246.16,268.95,"1,613.70",,,,,,
Поступление товаров АВ000000016 от 21.01.2014 15:02:25,,,,,,21.01.2014 15:02:25,АВ000000016,"ЗАО ""ТК ""МЕГАПОЛИС""",Да,"13,405.39",Да
"Сигареты Camel white, Ц0000001650",10.000,18%,89.62,58.75,587.52,,,,,,
"Сигареты LD  blue, Ц0000000750",10.000,18%,54.85,35.96,359.55,,,,,,
"Сигареты Русский стиль синие, Ц0000000259",20.000,18%,173.05,56.72,"1,134.45",,,,,,
"Сигареты Winston blue, Ц0000002058",50.000,18%,361.17,47.35,"2,367.67",,,,,,
"Сигареты Winston silver, Ц0000000264",20.000,18%,144.47,47.35,947.07,,,,,,
"Сигареты Winston XS blue, Ц0000000273",10.000,18%,77.56,50.85,508.46,,,,,,
"Сигареты Winston XStyle LSS blue, АВ000000136",20.000,18%,181.73,59.57,"1,191.33",,,,,,
"Сигареты Winston XS micro silver, Ц0000000461",10.000,18%,77.58,50.86,508.58,,,,,,
"Сигареты Davidoff classic slims, Ц0000000270",10.000,18%,107.53,70.49,704.93,,,,,,
"Сигареты Davidoff gold slims, Ц0000001139",10.000,18%,107.53,70.49,704.93,,,,,,
"Сигареты Союз Apollo C-19, Ц0000000188",10.000,18%,51.07,33.48,334.77,,,,,,
"Сигареты L&M red, Ц0000000184",10.000,18%,62.89,41.23,412.29,,,,,,
"Сигареты L&M blue, Ц0000000133",20.000,18%,125.78,41.23,824.58,,,,,,
"Сигареты Marlboro Lights, Ц0000002122",20.000,18%,198.90,65.20,"1,303.90",,,,,,
"Сигареты Parlament agua blue, Ц0000002060",20.000,18%,231.16,75.77,"1,515.36",,,,,,
Поступление товаров АВ000000017 от 21.01.2014 15:17:26,,,,,,21.01.2014 15:17:26,АВ000000017,"ООО ""ТД Минерал""",Да,"5,840.82",Да
"Вода Ессентуки № 4  1.5л, Ц0000000708",6.000,18%,22.26,24.32,145.92,,,,,,
"Вода мин.Боржоми 0,5л., ЕС000000382",60.000,18%,524.62,57.32,"3,439.20",,,,,,
"Вода мин.Боржоми 0,75л., ЕС000000381",30.000,18%,275.35,60.17,"1,805.10",,,,,,
"Вода мин.Ессентуки №17 экспорт.серия 1.5л., ЕС000000431",6.000,18%,22.88,25.00,150.00,,,,,,
"Вода Святой Источник газ.1,5л., ЕС000000471",6.000,18%,22.93,25.05,150.30,,,,,,
"Вода Святой Источник н/газ.1,5л., АВ000000204",6.000,18%,22.93,25.05,150.30,,,,,,
Поступление товаров АВ000000018 от 22.01.2014 12:42:57,,,,,,22.01.2014 12:42:57,АВ000000018,"ЗАО ""НЕСКО Санкт -Петербург""",Да,"5,499.10",Да
"Виски Баллантайнс Файнест 40% 0,7л., Ц0000001802",3.000,18%,463.62,"1,013.10","3,039.30",,,,,,
"Виски Вильям Лоусонс 40% 0.5л., Ц0000000166",5.000,18%,375.22,491.96,"2,459.80",,,,,,
Поступление товаров АВ000000019 от 23.01.2014 14:31:33,,,,,,23.01.2014 14:31:33,АВ000000019,"ООО""ПетроСнаб""",Да,"4,823.00",Да
"Напиток б/алк среднегаз. Вишня 0,5л., АВ000000401",6.000,18%,27.92,30.50,183.00,,,,,,
"Пиво Лидское Бархатное тёмн. 4,8% 1,5л., АВ000000400",6.000,18%,86.03,94.00,564.00,,,,,,
"Пиво Лидское Классическое светл. 5,1% 1,5л., АВ000000399",6.000,18%,84.20,92.00,552.00,,,,,,
"Пиво Черниговское Белое  неф. 4,8% 0,5л., ЕС000000318",20.000,18%,128.14,42.00,840.00,,,,,,
"Пиво Лидское Премиум свет.5,1% 0,5л., АВ000000398",10.000,18%,67.88,44.50,445.00,,,,,,
"Напиток б/алк среднегаз. Крем-Сода 0,5л., МЕ000000378",6.000,18%,27.92,30.50,183.00,,,,,,
"Напиток б/алк среднегаз. Лимон-Лайм 0,5л., МЕ000000425",6.000,18%,27.92,30.50,183.00,,,,,,
"Напиток б/алк среднегаз. Тархун 0,5л., АВ000000402",6.000,18%,27.92,30.50,183.00,,,,,,
"Пиво Коронет 4,6% 0,568л., МЕ000000063",20.000,18%,134.24,44.00,880.00,,,,,,
"Пиво Лидское Бархатное тёмн. 4,8% 0,5л., РТ000000035",20.000,18%,123.56,40.50,810.00,,,,,,
Поступление товаров АВ000000020 от 23.01.2014 16:27:24,,,,,,23.01.2014 16:27:24,АВ000000020,"ООО""Тамерлан""",Да,"2,389.00",Да
"Анчоус сушеный Джентри 36г., МЕ000000314",10.000,10%,30.91,34.00,340.00,,,,,,
"Кальмар сушеный  стружка Джентри 36г, МЕ000000315",5.000,10%,20.23,44.50,222.50,,,,,,
"Кольца кальмара Джентри 36 г., МЕ000000317",5.000,10%,23.18,51.00,255.00,,,,,,
"Кольца кальмара Джентри 90 г., МЕ000000318",5.000,10%,51.45,113.20,566.00,,,,,,
