Поступление товаров,,,,,,,,,,,
"Морс Северная Ягода Клюква  0,95л., Ц0000001722",12.000,10%,55.28,50.67,608.09,,,,,,
"Сок Фруктовый Сад апельсин 0,95л., Ц0000001712",12.000,10%,43.26,39.66,475.90,,,,,,
"Лимонад Пепси Макс ж/б 0,33л., Ц0000001673",12.000,18%,37.81,20.65,247.84,,,,,,
"Нектар Фруктовый Сад мультифрукт 1,93л., Ц0000001720",6.000,10%,35.00,64.17,385.00,,,,,,
Поступление товаров ЕС000000369 от 27.12.2013 13:06:31,,,,,,27.12.2013 13:06:31,ЕС000000369,"ООО""Тамерлан""",Да,"3,653.10",Да
"Рыба вялен. филе Трески Джентри 45г, МЕ000000310",5.000,10%,27.73,61.00,305.00,,,,,,
"Сыр копчено-вяленый Джентри 36 г., МЕ000000308",5.000,10%,19.09,42.00,210.00,,,,,,
"Кольца кальмара Джентри 90 г., МЕ000000318",5.000,10%,51.45,113.20,566.00,,,,,,
"Желтый полосатик сушеный Джентри 90г, МЕ000000313",2.000,10%,16.73,92.00,184.00,,,,,,
"Рыба вялен. суш. Тарань Джентри 140г, МЕ000000323",4.000,10%,14.73,40.50,162.00,,,,,,
"Кольца кальмара Джентри 36 г., МЕ000000317",4.000,10%,18.55,51.00,204.00,,,,,,
"Рыба вялен. суш. Вобла Джентри 80г, МЕ000000324",3.000,10%,13.64,50.00,150.00,,,,,,
"Рыба вялен. суш. Чехонь Джентри 80г, МЕ000000319",4.000,10%,20.18,55.50,222.00,,,,,,
"Рыба вялен. филе Трески Джентри 90г, МЕ000000311",5.000,10%,52.05,114.50,572.50,,,,,,
"Семечки Потеха белые с солью100гр., МЕ000000327",12.000,10%,33.05,30.30,363.60,,,,,,
"Желтый полосатик сушеный Джентри 36г, МЕ000000312",10.000,10%,33.64,37.00,370.00,,,,,,
"Семечки Fishka белые со вкусом томатов 100гр., МЕ000000329",10.000,10%,31.27,34.40,344.00,,,,,,
Поступление товаров ЕС000000370 от 27.12.2013 13:49:32,,,,,,27.12.2013 13:49:32,ЕС000000370,"ЗАО ""НЕСКО Санкт -Петербург""",Да,"11,788.05",Да
"Коньяк Хеннесси  ВС  П/У  0.5л 40%, ЕС000000467",2.000,18%,551.17,"1,806.60","3,613.20",,,,,,
"Коньяк Хеннесси ВСОП 40% 0,5, Ц0000000556",1.000,18%,394.37,"2,585.33","2,585.33",,,,,,
"Коньяк Хеннесси X.О 40%  п/у 0,35л., ЕС000000645",1.000,18%,852.64,"5,589.52","5,589.52",,,,,,
Поступление товаров ЕС000000371 от 27.12.2013 14:19:34,,,,,,27.12.2013 14:19:34,ЕС000000371,"ООО ""Евролюкс""",Да,"1,564.68",Да
"Кальмар сушеный 40 г, Ц0000001203",10.000,10%,30.65,33.72,337.20,,,,,,
"Сухарики Емеля Сыр 40г, ЕС000000531",15.000,10%,11.02,8.08,121.20,,,,,,
"Кальмар сушеный 18 г, Ц0000001205",10.000,10%,14.45,15.90,159.00,,,,,,
"Сухарики Емеля Икра 40г, ЕС000000533",15.000,10%,11.02,8.08,121.20,,,,,,
"Сухарики Емеля Жареная дичь 40г, ЕС000000532",15.000,10%,11.02,8.08,121.20,,,,,,
"Сухарики Емеля Маринованный огурчик  40г, ЕС000000530",15.000,10%,11.02,8.08,121.20,,,,,,
"Сухарики Хрустим томат  40гр., ЕС000000174",10.000,10%,8.29,9.12,91.20,,,,,,
"Сухарики Хрустим Телятина на Гриле 40, Ц0000001732",10.000,10%,8.29,9.12,91.20,,,,,,
"Сухарики Хрустим сыр 40, Ц0000001730",14.000,10%,11.61,9.12,127.68,,,,,,
"Сухарики Хрусттим Сметана 40гр., Ц0000001065",20.000,10%,16.58,9.12,182.40,,,,,,
"Сухарики Хрусттим Лесные Грибы 40гр., АВ000000186",10.000,10%,8.29,9.12,91.20,,,,,,
Поступление товаров ЕС000000372 от 27.12.2013 15:34:52,,,,,,27.12.2013 15:34:52,ЕС000000372,"ООО""НОРДЭКС""",Да,"13,098.00",Да
"Вино Аргенто Пино Гриджио  бел.сух. 13% 0,75л., АВ000000124",6.000,18%,227.90,249.00,"1,494.00",,,,,,
"Вино Лайонз Хилл кр.п/сл. 12% 0,75л. , ЕС000000228",3.000,18%,85.12,186.00,558.00,,,,,,
"Вино Молоко Любимой Женщины бел.п/сл. 9.5% 0,75л., Ц0000002067",6.000,18%,151.93,166.00,996.00,,,,,,
"Вино игристое Анри Марсель  бел.брют 10,5% 0,75л., ЕС000000101",30.000,18%,874.07,191.00,"5,730.00",,,,,,
"Вино игристое Платино Москато бел.п/сл. 7% 0,75л., ЕС000000183",6.000,18%,172.98,189.00,"1,134.00",,,,,,
"Вино игристое Дон Лусиано Москато бел. п/сл. п/у 7% 0,75л., МЕ000000409",6.000,18%,222.41,243.00,"1,458.00",,,,,,
"Игристые вина Кристалино  бел.п/сух.  11,5% 0,75л., МЕ000000411",6.000,18%,263.59,288.00,"1,728.00",,,,,,
Поступление товаров ЕС000000375 от 27.12.2013 15:34:53,,,,,,27.12.2013 15:34:53,ЕС000000375,"ООО КОМПАНИЯ ""СИМПЛ-СПБ""",Да,"7,488.48",Да
"Вино игристое Канти Асти бел.сл.7% 0,75л., АВ000000389",6.000,18%,349.92,382.32,"2,293.92",,,,,,
"Вино игристое Канти Просекко бел.сух.11% 0,75л., АВ000000390",6.000,18%,367.71,401.76,"2,410.56",,,,,,
"Вино игристое Ламбруско дель`Эмилия Россо Подери Альти кр.п/сл.7,5% 0,75л., АВ000000387",6.000,18%,212.34,232.00,"1,392.00",,,,,,
"Вино игристое Ламбруско дель`Эмилия Подери Альти бел.п/сл.7,5% 0,75л., АВ000000388",6.000,18%,212.34,232.00,"1,392.00",,,,,,
Поступление товаров ЕС000000373 от 28.12.2013 11:50:38,,,,,,28.12.2013 11:50:38,ЕС000000373,"ООО ""ЕВРО-АРТ""",Да,"4,460.41",Да
"Вино Ле Вье Мас Кот Дю Рон кр.сух.13% 0.75л., Ц0000000105",2.000,18%,56.91,186.54,373.08,,,,,,
"Вино игристое Ламбруско Виа Мирелла бел.сл.7.5% 0,75л., Ц0000001170",23.000,18%,623.49,177.71,"4,087.33",,,,,,
Поступление товаров ЕС000000374 от 30.12.2013 12:22:35,,,,,,30.12.2013 12:22:35,ЕС000000374,"ООО""ТД Каскад""",Да,"12,017.00",Да
"Водка Беленькая 40% 0,25л., Ц0000001256",10.000,18%,176.95,116.00,"1,160.00",,,,,,
"Вино Брояница кр.п/сл. 11% 0,75л., ЕС000000425",6.000,18%,,185.00,"1,110.00",,,,,,
"Вино игристое Руиберг Вайнери безалкогольное 0,75л., ЕС000000427",2.000,18%,141.99,465.40,930.80,,,,,,
"Вино Эшера   кр. п/сух. 10% 0,75л., ЕС000000423",6.000,18%,258.10,282.00,"1,692.00",,,,,,
"Чача Абхазская Ачара 45% 0,5л., ЕС000000428",4.000,18%,341.88,560.30,"2,241.20",,,,,,
"Виски Грантс 40% 0,2л., Ц0000001190",10.000,18%,486.76,319.10,"3,191.00",,,,,,
"Вино Чегем  кр.сух. 11% 0,75л., ЕС000000420",6.000,18%,258.10,282.00,"1,692.00",,,,,,
Поступление товаров ЕС000000376 от 30.12.2013 16:43:56,,,,,,30.12.2013 16:43:56,ЕС000000376,"ООО""ТД""Русьимпорт-Нева""",Да,"5,919.37",Да
"Вино Медиум Свит Медитерране Ж.П.Шене кр. п/сл.12% 0,75л., АВ000000320",3.000,18%,164.74,359.99,"1,079.98",,,,,,
"Вино Пино Гриджио дель Венецие Сантори бел.сух.12% 0,75л., АВ000000323",3.000,18%,141.39,308.96,926.88,,,,,,
"Коньяк Амирани 5 лет 40% 0,5л., АВ000000391",3.000,18%,233.77,510.83,"1,532.50",,,,,,
"Виски Таханнок Бурбон 40% 0,7л., АВ000000332",4.000,18%,363.05,595.00,"2,380.01",,,,,,
Поступление товаров ЕС000000377 от 30.12.2013 16:48:23,,,,,,30.12.2013 16:48:23,ЕС000000377,"ООО""ТД""Русьимпорт-Нева""",Да,"2,163.51",Да
"Вино игристое Просекко Эрфо Брют Сартори бел.брют 11% 0,75л., АВ000000392",6.000,18%,330.03,360.59,"2,163.51",,,,,,
Поступление товаров ЕС000000378 от 31.12.2013 11:26:25,,,,,,31.12.2013 11:26:25,ЕС000000378,"ЗАО ""ТК ""МЕГАПОЛИС""",Да,"14,074.82",Да
"Сигареты Glamour lilac, Ц0000000173",10.000,18%,69.55,45.60,455.95,,,,,,
"Сигареты LD pink, Ц0000000220",10.000,18%,54.85,35.96,359.55,,,,,,
"Сигареты Sobranie Superslims White, ЕС000000497",10.000,18%,108.16,70.91,709.06,,,,,,
"Сигареты Wings red, Ц0000001851",10.000,18%,54.34,35.62,356.24,,,,,,
"Сигареты Winston blue, Ц0000002058",20.000,18%,144.47,47.35,947.07,,,,,,
"Сигареты Winston super slims white, Ц0000000056",20.000,18%,144.47,47.35,947.07,,,,,,
"Сигареты Winston XS blue, Ц0000000273",10.000,18%,77.56,50.85,508.46,,,,,,
"Сигареты Winston XSence silver, Ц0000002110",10.000,18%,77.56,50.85,508.46,,,,,,
"Сигареты Davidoff gold slims, Ц0000001139",10.000,18%,107.53,70.49,704.93,,,,,,
"Сигареты Davidoff shape white, Ц0000000190",10.000,18%,99.45,65.20,651.95,,,,,,
"Сигареты Союз Apollo C-19, Ц0000000188",10.000,18%,51.07,33.48,334.77,,,,,,
"Сигареты Chesterfield red, Ц0000002111",10.000,18%,73.93,48.46,484.63,,,,,,
"Сигареты L&M blue, Ц0000000133",10.000,18%,62.89,41.23,412.29,,,,,,
"Сигареты Marlboro Fillter plus, Ц0000000189",10.000,18%,99.45,65.20,651.95,,,,,,
"Сигареты Marlboro Lights, Ц0000002122",10.000,18%,99.45,65.20,651.95,,,,,,
"Сигареты Parlament night blue, Ц0000002113",20.000,18%,231.16,75.77,"1,515.36",,,,,,
"Сигареты Parlament agua blue, Ц0000002060",20.000,18%,231.16,75.77,"1,515.36",,,,,,
"Сигареты Parlament silver blue, Ц0000002059",20.000,18%,231.16,75.77,"1,515.36",,,,,,
"Сигареты Parlament Reserve super slims, ЕС000000338",10.000,18%,128.81,84.44,844.41,,,,,,
Поступление товаров ЕС000000379 от 31.12.2013 12:03:16,,,,,,31.12.2013 12:03:16,ЕС000000379,"ООО ""ТК Балтика""",Да,929.50,Да
"Коньяк Золотая выдержка 4 зв. 40% 0,25л., ЕС000000582",5.000,18%,141.79,185.90,929.50,,,,,,
Поступление товаров ЕС000000380 от 31.12.2013 12:38:36,,,,,,31.12.2013 12:38:36,ЕС000000380,"ООО ""Лудинг-СПб""",Да,"6,416.00",Да
"Бренди Плиска 5 лет  36% 0.5л., МЕ000000167",2.000,18%,143.39,470.00,940.00,,,,,,
"Коньяк НОЙ Араспел 3-х летний п/у 40% 0,5 л., ЕС000000507",4.000,18%,378.31,620.00,"2,480.00",,,,,,
"Коньяк НОЙ Араспел 5 летний п/у 40% 0,5 л., ЕС000000508",4.000,18%,457.02,749.00,"2,996.00",,,,,,
Поступление товаров ЕС000000381 от 31.12.2013 16:12:50,,,,,,31.12.2013 16:12:50,ЕС000000381,"ЗАО ""НЕСКО Санкт -Петербург""",Да,"9,206.56",Да
"Вермут Мартини Экстра Драй 18% 0,5л., Ц0000000285",4.000,18%,224.35,367.69,"1,470.76",,,,,,
"Вино игристое Мартини Просекко бел.сух. 11.5% 0.75л., Ц0000000373",3.000,18%,270.35,590.76,"1,772.28",,,,,,
"Ром Олд Ник золотой 37,5% 0,7л., МЕ000000295",6.000,18%,502.47,549.00,"3,294.00",,,,,,
"Вино игристое Мартини Брют 11,5% 0,75л., ЕС000000458",3.000,18%,407.21,889.84,"2,669.52",,,,,,
Поступление товаров ЕС000000001 от 03.01.2014 12:38:08,,,,,,03.01.2014 12:38:08,ЕС000000001,"ООО ""ТД Минерал""",Да,"2,744.20",Да
"Вода Вартемяжская природная артез. негаз. 6л., ЕС000000415",4.000,18%,22.88,37.50,150.00,,,,,,
"Вода мин.Ессентуки 4 экспорт.серия 1.5л., ЕС000000380",6.000,18%,22.88,25.00,150.00,,,,,,
"Вода мин.Ессентуки №17 экспорт.серия 1.5л., ЕС000000431",6.000,18%,22.88,25.00,150.00,,,,,,
"Вода мин.Ессентуки 4 экспорт.серия  бут. 0,5л., ЕС000000414",20.000,18%,70.17,23.00,460.00,,,,,,
"Вода мин.Боржоми 0,75л., ЕС000000381",24.000,18%,220.28,60.17,"1,444.08",,,,,,
"Вода мин.Новотерская Целебная газ.0,5л., ЕС000000378",6.000,18%,13.66,14.92,89.52,,,,,,
"Вода Святой Источник газ.1,5л., ЕС000000471",6.000,18%,22.93,25.05,150.30,,,,,,
"Вода Святой Источник н/газ.1,5л., АВ000000204",6.000,18%,22.93,25.05,150.30,,,,,,
Поступление товаров ЕС000000002 от 10.01.2014 16:05:52,,,,,,10.01.2014 16:05:52,ЕС000000002,"ООО ""ЕВРО-АРТ""",Да,"7,777.88",Да
"Пиво Саку Оригинал свет. 4.6% 0.5л., АВ000000023",10.000,18%,101.44,66.50,665.00,,,,,,
"Пиво Юзберг Пшеничное нефильт.свет.4,9% 0,5л., РТ000000145",20.000,18%,141.89,46.51,930.20,,,,,,
"Вино Хванчкара Ахалшени кр.п/сл.11,3% 0,75л., АВ000000384",4.000,18%,279.88,458.70,"1,834.80",,,,,,
"Вино Миранзана Кьянти Колли Фьорентини кр.сух.13% 0,75л., РТ000000129",6.000,18%,185.00,202.13,"1,212.78",,,,,,
"Коньяк Старый Кенигсберг 4 зв. 40% 0.1л., ЕС000000003",20.000,18%,253.34,83.04,"1,660.80",,,,,,
"Пиво Юзберг Келлер светлое нефильтрованное 4,4% 0,5л., МЕ000000223",20.000,18%,128.41,42.09,841.80,,,,,,
"Коньяк Российский ККК 3 зв. 40% 0,25л., ЕС000000646",5.000,18%,96.48,126.50,632.50,,,,,,
Поступление товаров ЕС000000003 от 13.01.2014 12:51:32,,,,,,13.01.2014 12:51:32,ЕС000000003,"ООО ""Монблан Премиум""",Да,"4,469.94",Да
"Пиво Циндао свет.  4,7% ж/б  0,5л., ЕС000000022",12.000,18%,141.85,77.49,929.88,,,,,,
"Пиво Кайзердом Пилснер свет.ж/б 1,0 4,7%, РТ000000236",3.000,18%,98.33,214.86,644.58,,,,,,
"Пиво Кайзердом Хефе-Вайсбир свет.нефильт.ж/б 1,0 4,7%, РТ000000235",3.000,18%,98.33,214.86,644.58,,,,,,
"Пиво Брэйнс Блэк темн.0,44 4,1%, РТ000000243",6.000,18%,88.78,97.00,582.00,,,,,,
"Пивной напиток Белжиан Пич персик свет.0,33 3,5%, РТ000000248",6.000,18%,120.64,131.81,790.86,,,,,,
"Сидр Кингстон Пресс 0,66 5,3%, РТ000000252",6.000,18%,133.94,146.34,878.04,,,,,,
Поступление товаров ЕС000000004 от 13.01.2014 17:34:17,,,,,,13.01.2014 17:34:17,ЕС000000004,"ООО ""Сигарный Дом Фортуна""",Да,"2,837.77",Да
"Сигариллы Cafe Creme, РТ000000319",4.000,18%,73.10,119.81,479.22,,,,,,
"Сигариллы Half Corona, ЕС000000608",3.000,18%,76.88,168.00,503.99,,,,,,
"Сигары Guantanamera Cristal, ЕС000000609",4.000,18%,101.84,166.90,667.60,,,,,,
"Сигариллы Handelsgold Cherry Cigarillos, РТ000000318",5.000,18%,35.16,46.10,230.51,,,,,,
"Сигариллы Handelsgold Vanilla Cigarillos, РТ000000317",5.000,18%,35.16,46.10,230.51,,,,,,
"Сигариллы Handelsgold VanillaTip, ЕС000000616",3.000,18%,30.75,67.20,201.60,,,,,,
"Зажигалка Zenga Mega  jet Russia, МЕ000000401",12.000,18%,79.98,43.70,524.34,,,,,,
Поступление товаров ЕС000000005 от 14.01.2014 14:32:35,,,,,,14.01.2014 14:32:35,ЕС000000005,"ООО ""ЕВРО-АРТ""",Да,"15,610.51",Да
"Вино Миранзана Бардолино DOC кр.сух.12% 0,75л., РТ000000128",6.000,18%,171.85,187.76,"1,126.56",,,,,,
"Вино Форе Дэ Конт бел.п/сл.11% 0,75л., Ц0000001100",6.000,18%,140.00,152.96,917.76,,,,,,
"Вино Тоскано IGT Иль Фонтино кр.сух.0.75 12%, РТ000000125",3.000,18%,79.38,173.46,520.38,,,,,,
"Коньяк Гордый Севастополь 40% 0,25л., Ц0000000297",5.000,18%,122.79,160.99,804.95,,,,,,
"Шампанское Абрау-Дюрсо роз.п/сух. 10,5-13,0% 0,75л., ЕС000000563",6.000,18%,210.39,229.87,"1,379.22",,,,,,
"Вино Антонио Барбадилло кр.п/сл.14% 0.75л., РТ000000002",6.000,18%,158.06,172.70,"1,036.20",,,,,,
"Вино Алазанская Долина глина бел.п/сл.10-12% 0,75л., АВ000000159",2.000,18%,102.80,336.95,673.90,,,,,,
"Настойка горькая Петроградская водочка лайм 38% 0,5л., МЕ000000138",3.000,18%,72.24,157.85,473.55,,,,,,
"Настойка горькая Петроградская водочка айва 38% 0,5л., МЕ000000137",3.000,18%,72.24,157.85,473.55,,,,,,
"Пиво Юзберг Келлер светлое нефильтрованное 4,4% 0,5л., МЕ000000223",20.000,18%,128.41,42.09,841.80,,,,,,
"Пиво Юзберг Черное темное  пастер.фильтрованное 4,9% 0,5л., МЕ000000224",20.000,18%,141.89,46.51,930.20,,,,,,
"Вино Къянти Гранди Вини DOCG  кр.сух.12.5% 0,75л., Ц0000002100",6.000,18%,185.00,202.13,"1,212.78",,,,,,
"Вино Примо Альберо Соаве DOC бел.сух.12% 0,75л., РТ000000117",6.000,18%,171.85,187.76,"1,126.56",,,,,,
"Водка Путинка графин 40% 0.75л., Ц0000000992",3.000,18%,261.76,572.00,"1,716.00",,,,,,
"Водка Путинка мягкая 40% 0.5л., Ц0000000957",5.000,18%,159.41,209.00,"1,045.00",,,,,,
"Коньяк Сквозь Столетия 5 зв. 40% 0.5л., Ц0000000294",2.000,18%,97.49,319.55,639.10,,,,,,
"Коньяк Сквозь Столетия КВ черн.туба 41% 0,5л., Ц0000001867",3.000,18%,105.71,231.00,693.00,,,,,,
Поступление товаров ЕС000000006 от 15.01.2014 11:31:29,,,,,,15.01.2014 11:31:29,ЕС000000006,"ООО ""ТК Балтика""",Да,"4,644.28",Да
"Коньяк Золотая выдержка 4 зв. 40% 0,25л., ЕС000000582",3.000,18%,96.97,211.90,635.70,,,,,,
"Коньяк Золотая Выдержка  5 зв.40% 0,25л., Ц0000001957",5.000,18%,183.43,240.50,"1,202.50",,,,,,
"Коньяк  Командирский 3 зв. фляга 40% 0,5л , ЕС000000647",3.000,18%,144.32,315.36,946.08,,,,,,
"Водка Серебряная Грань 40% 0,5л., АВ000000281",6.000,18%,141.86,155.00,930.00,,,,,,
"Водка Золотая Грань 40% 0,5л., АВ000000282",6.000,18%,141.86,155.00,930.00,,,,,,
Поступление товаров ЕС000000007 от 15.01.2014 12:35:40,,,,,,15.01.2014 12:35:40,ЕС000000007,"ОАО ""Л Дистрибьюшен""",Да,"22,162.17",Да
"Коньяк Арарат  5 зв. п/у 40% 0,5л.  , Ц0000001794",5.000,18%,461.36,604.89,"3,024.45",,,,,,
"Вино Каса Нери Темпранильо кр.сух.12,5% 0,75л., АВ000000380",3.000,18%,68.99,150.76,452.28,,,,,,
"Виски Бурбон Джим Бим Блэк 6 лет  43% 0,7л., ЕС000000136",1.000,18%,217.35,"1,424.87","1,424.87",,,,,,
"Виски Джонни Уокер Блек Лейбл п/у  40% 0,5л., Ц0000001354",1.000,18%,220.41,"1,444.93","1,444.93",,,,,,
"Ром  Гавана Клуб 3 года 40% 0,7л., Ц0000001790",1.000,18%,126.40,828.63,828.63,,,,,,
"Вино Кюве Ля Вильер кр.п/сл.11% 0,75л., АВ000000345",3.000,18%,89.12,194.75,584.25,,,,,,
"Вино Каса Нери Виура бел.сух.12% 0,75л., АВ000000379",3.000,18%,68.99,150.76,452.28,,,,,,
"Вино Портобелло Неро Д`АволаТерре Сицилиане кр.сух.12% 0,75л., АВ000000347",3.000,18%,99.99,218.50,655.50,,,,,,
"Вино Пасифико Сур Каберне Совиньон кр.сух.13,5% 0,75л., Ц0000001904",3.000,18%,108.69,237.50,712.50,,,,,,
"Водка Царская ориг.40% 0.5л., Ц0000000993",3.000,18%,152.00,332.15,996.45,,,,,,
"Водка Царская Золотая 40% 0,5л., Ц0000000991",3.000,18%,153.93,336.36,"1,009.08",,,,,,
"Водка Царская Золотая 40% 0,7л., Ц0000000659",2.000,18%,187.42,614.33,"1,228.66",,,,,,
"Коньяк Арарат 5 лет 40% 0,25л., Ц0000001793",5.000,18%,242.38,317.79,"1,588.95",,,,,,
"Коньяк Мартель В.С.О.П. Медальон 40% 0,5л., Ц0000001872",1.000,18%,288.90,"1,893.87","1,893.87",,,,,,
"Виски Уайт Хорс, 0,35л. 40%, Ц0000001364",4.000,18%,203.68,333.81,"1,335.24",,,,,,
"Вино Конде Отинано Крианца кр.сух. 13% 0,75л., АВ000000342",3.000,18%,162.68,355.48,"1,066.44",,,,,,
"Виски Баллантайнс Файнест 40% 0,5л., Ц0000001801",4.000,18%,433.72,710.82,"2,843.28",,,,,,
"Ром Ямайский Капитан Морган  0,5л, ЕС000000648",1.000,18%,94.65,620.51,620.51,,,,,,
Поступление товаров ЕС000000008 от 15.01.2014 17:14:50,,,,,,15.01.2014 17:14:50,ЕС000000008,"ООО ""Невский синдикат""",Да,"3,069.48",Да
"Коктейль Голден Кэп с ябл. вкусом 6% 0.33л, МЕ000000416",12.000,18%,77.76,42.48,509.76,,,,,,
"Напиток сл/алк.Синебрюхофф Джин и Грейпфрут ж/б 8,8% 0,33л., МЕ000000418",12.000,18%,84.08,45.93,551.16,,,,,,
"Напиток сл/алк.Синебрюхофф Джин и Грейпфрут ж/б 8,8% 0,5л., ЕС000000373",24.000,18%,228.63,62.45,"1,498.80",,,,,,
"Коктейль Голден Кэп с груш. вкусом 6% 0.33л, МЕ000000417",12.000,18%,77.76,42.48,509.76,,,,,,
Поступление товаров ЕС000000009 от 17.01.2014 11:14:56,,,,,,17.01.2014 11:14:56,ЕС000000009,"ООО ""ЕВРО-АРТ""",Да,"12,951.21",Да
"Вино Иль Фонтино Кьянти 2008  кр.сух.12% 0.5л., Ц0000000427",3.000,18%,102.77,224.58,673.74,,,,,,
"Вино игристое Ламбруско Виа Мирелла бел.сл.7.5% 0,75л., Ц0000001170",12.000,18%,325.30,177.71,"2,132.52",,,,,,
"Водка Беленькая Люкс 40% 0.5л., Ц0000001000",5.000,18%,137.59,180.40,902.00,,,,,,
"Коньяк Камю ВС   40% 0,5л., МЕ000000095",1.000,18%,200.01,"1,311.20","1,311.20",,,,,,
"Виски Клан МакГрегор 40% 0,75л., Ц0000000559",3.000,18%,235.08,513.70,"1,541.10",,,,,,
"Напиток винный Боска газ.бел.п/сл. 7,5% 0,75л., ЕС000000633",6.000,18%,172.43,188.40,"1,130.40",,,,,,
"Напиток винный Боска газ.бел.п/сухой. 7,5% 0,75л., МЕ000000400",6.000,18%,172.43,188.40,"1,130.40",,,,,,
"Напиток винный Боска газ.бел.сл. 7,5% 0,75л., АВ000000371",6.000,18%,172.43,188.40,"1,130.40",,,,,,
"Вино Алазанская Долина  кр.п/сл. Батоно бут. 10,5-12,5% 0,75л., ЕС000000456",2.000,18%,66.66,218.50,437.00,,,,,,
"Виски Грантс 40% 0,75л., Ц0000001187",3.000,18%,390.88,854.15,"2,562.45",,,,,,
Поступление товаров ЕС000000010 от 17.01.2014 12:29:49,,,,,,17.01.2014 12:29:49,ЕС000000010,"ООО""Тамерлан""",Да,"1,158.10",Да
"Сыр копчено-вяленый Джентри 70г., МЕ000000309",5.000,10%,31.82,70.00,350.00,,,,,,
"Камбала  обесшкур.Джентри 45гр., ЕС000000649",2.000,10%,11.09,61.00,122.00,,,,,,
"Рыба вялен. суш. Корюшка Джентри 80г, МЕ000000321",3.000,10%,13.50,49.50,148.50,,,,,,
"Рыба вялен. суш. Вобла Джентри 80г, МЕ000000324",3.000,10%,13.64,50.00,150.00,,,,,,
"Орехи Арахис Добрый замок 30г, ЕС000000651",3.000,18%,3.62,7.90,23.70,,,,,,
"Орехи Фисташки Добрый замок 30г, ЕС000000652",3.000,18%,11.17,24.40,73.20,,,,,,
"Семечки Fishka Отборные жарен. 100гр., ЕС000000650",3.000,10%,6.90,25.30,75.90,,,,,,
"Семечки Раздолье 250гр., МЕ000000325",4.000,10%,19.53,53.70,214.80,,,,,,
Поступление товаров ЕС000000011 от 21.01.2014 15:48:14,,,,,,21.01.2014 15:48:14,ЕС000000011,"ООО ""ЕВРО-АРТ""",Да,"13,464.34",Да
"Вино Иль Фонтино Кьянти 2008  кр.сух.12% 0.5л., Ц0000000427",6.000,18%,205.55,224.58,"1,347.48",,,,,,
"Вино игристое Спуманте Дольче АП бел.сл. 9,5% 0,75 л., МЕ000000030",6.000,18%,222.45,243.05,"1,458.30",,,,,,
"Вино Шато Пине Ля Усе АОС кр. сух.  алк 13% 0.75л , Ц0000000097",6.000,18%,197.99,216.32,"1,297.92",,,,,,
"Вино Примо Альберо Инзолия бел.сух.12% 0,75л., МЕ000000221",3.000,18%,74.45,162.68,488.04,,,,,,
"Водка Двойная Белая 40% 0.5л., Ц0000000928",3.000,18%,75.51,165.00,495.00,,,,,,
"Вино Хванчкара Ахалшени кр.п/сл.11,3% 0,75л., АВ000000384",3.000,18%,209.91,458.70,"1,376.10",,,,,,
"Коньяк Старый Кенигсберг 4 зв. 40% 0.1л., ЕС000000003",15.000,18%,190.01,83.04,"1,245.60",,,,,,
"Коньяк Старый Кенигсберг 4-лет.40% 0,375л., РТ000000015",10.000,18%,434.04,284.54,"2,845.40",,,,,,
"Вино Алазанская Долина  кр.п/сл. Батоно бут. 10,5-12,5% 0,75л., ЕС000000456",3.000,18%,99.99,218.50,655.50,,,,,,
"Водка Белуга 40% 0.5л., Ц0000000985",1.000,18%,88.93,583.00,583.00,,,,,,
"Водка Корела 40% 0,5л., Ц0000001258",3.000,18%,95.64,209.00,627.00,,,,,,
"Водка Путинка мягкая 40% 0.5л., Ц0000000957",5.000,18%,159.41,209.00,"1,045.00",,,,,,
Поступление товаров ЕС000000012 от 21.01.2014 16:38:17,,,,,,21.01.2014 16:38:17,ЕС000000012,"ООО ""ТД Минерал""",Да,"5,685.54",Да
